Page #,Question #,Question Text,Answer
83,54,Catch 22 had what original name - publisher changed it,Catch 18
83,59,What book was given to all officers in the Confederate army,Les Miserables
83,62,Who was the voice of Scooby Doo,Mickey Dolenz
83,65,Joan Peters became famous as who,Carol Lombard
83,68,Wimpy was the working title of what classic movie,Psycho
83,73,What magazine has the largest unpaid circulation in the US,Disney Channel Magazine
83,74,More than 100 women make a living from impersonating who,Marilyn Monroe
83,97,Mary Leta Dorothy Slaton became famous as who,Dorothy Lamour
