Page #,Question #,Question Text,Answer
127,62,In film who is the alter ego of Daniel Hillard?,Mrs Doubtfire
127,63,Who was the female star of Basic Instinct?,Sharon Stone
127,74,Name the first British film studio set up in the 1930s?,Pinewood Studios
127,75,In Hill Street Blues which character used to bite people?,Animal - Mick
127,82,"What Disney film features the song ""Give a little Whistle""?",Pinocchio
127,85,Gone to Texas by Forest Carter is the basis for what film?,The Outlaw Josey Wales
127,91,Thomas and Martha were the parents of which hero?,Batman
127,95,Who was the first woman to win an Academy Award?,Janet Gaynor 1929
127,99,Name Clint Eastwoods first film made in 1955?,Francis in the Navy (1955)
