Page #,Question #,Question Text,Answer
97,53,Name Dennis the Menace dog Hank Ketchum comics 1950s,Ruff
97,67,What French actors catch phrase Come with me to the Casbah,"Charles Boyer – in
Algiers"
97,70,Who first appeared in The Mysterious Affair at Styles,Hercule Poirot
97,77,In Maryland it is illegal to take what to the movies,A Lion
97,88,What US film was based on Thomas Dixons The Clansman,Birth of a Nation
97,93,Family lived small farm Walnut Grove Plumb Creek Minnesota,"Ingles - Little House
on Prairie"
97,94,Laurence Skikne changed his name to what and found fame,Laurence Harvey
97,96,Shakespeare character in The Tempest is the son of Sycorax,Caliban
97,100,Who wrote The Hitchhikers Guide to the Galaxy,Douglas Adams
