Page #,Question #,Question Text,Answer
180,5,Who began his career as The Worlds Worst Juggler,Fred Astair
180,7,Who was the first woman to win an acting Emmy in a sf series,Lindsay Wagner – Bionic Woman
180,8,What is the most assigned book / play  in English classes,Romeo and Juliet
180,9,Name the Shakespeare play with a city in Greece in name,Timon of Athens
180,21,Who spoke for the first time in a Bugs Bunny cartoon in 1951,Roadrunner
180,29,Which Clint Eastwood film has the most killings (65),Where Eagles Dare
180,40,Where are Gene Roddenberrys ashes,Sent into Space
180,47,In Dukes of Hazard boys drove General Lee name Daisies jeep,Dixie
