Page #,Question #,Question Text,Answer
164,2,David Cornwell is better known as which author,John Le Carr
164,3,Puccini's Turendot is set in which country,China
164,13,Why did Disney recall his first celluloid Donald Duck toys,"They exploded into
flames"
164,18,In which film did we meet Baron Numpsi as the villain,"Eddie Murphy's The
Golden Child"
164,31,What original story begins Aladdin was a little Chinese boy,1001 Arabian Nights
164,46,Reverend Marcus Morris founded which UK comic in the 50s,Eagle
164,48,Who played the doctor in the rock opera Tommy,Jack Nicholson
