Page #,Question #,Question Text,Answer
169,55,Who was the first rock star arrested on stage,Jim Morrison of the Doors
169,56,Which authors personal publishing venture is Philtrum Press,Steven King
169,61,In the Beatles White Album who was Martha my Dear,Paul McCartney's Sheepdog
169,63,Who owned a cat called Apollinaris,Mark Twain
169,80,Which writer invented the word drab,C S Lewis
169,87,Name Steve McQueen's Karate teacher - later an actor,Chuck Norris
169,92,In the Batman comics what is the full real identity of the Riddler,Edward Enigma E Enigma
169,98,The worlds first opened in Los Angles April 2nd 1902 - what,Motion picture theatre
