Page #,Question #,Question Text,Answer
111,55,Johnny Depp is afraid of what,Clowns
111,74,In Star Trek who would go to Sha Ka Ree,Vulcans it’s heaven
111,77,Name the Monkeys only film made in 1969,Head
111,84,Roschfort was a baddie in what book and (many) film versions,The Three Musketeers
111,85,James Doohan became famous playing what character,Montgomery Scott
111,86,Name Popeye's hungry friend,J Wellington Wimpy
111,88,November 18th is who's birthday,Mickey Mouse
111,97,What was the first daily comic strip in the USA,Mutt and Jeff
111,98,Review This show suspends all belief it will never work what ?,Original Star Trek
