Page #,Question #,Question Text,Answer
167,61,"The young are called widgets, females fifinellas what are they",Gremlins
167,69,Crystal City in Texas put up a statue to what cartoon character,Popeye - they are spinach growers
167,73,"""Broom"" Bromden an Indian narrates which famous book",One Flew over the Cuckoos Nest
167,77,Which literary character takes his name from Latin for nobody,Captain Nemo
167,87,All the Richard Hannay books got their titles from where,Bunyon's The Pilgrims Progress
167,88,Whose film debut was Jennings in Revenge of the Creature 1955,Clint Eastwood
167,1,What was the first doctor film made in 1954,Doctor in the House
