Page #,Question #,Question Text,Answer
21,64,Peter Falk plays Lt Colombo but who was first offered role,Bing Crosby
21,65,What type of birds (Hugin + Munin) sit on the shoulders of Odin,Ravens
21,75,William Tayton was the first man to do what,Appear on TV – at Bairds demo
21,76,Clemintina Campbell famous as who,Cleo Lane
21,81,What pop group took their name from a Herman Hess novel,Steppenwolff
21,86,For what would an Edgar be awarded or won,Mystery Writing
21,93,Arthur Jefferson better known as who,Stan Laurel
