Page #,Question #,Question Text,Answer
121,63,Bambi was the first Disney film without what,Human characters
121,65,Film character played by 4 people head body voice breathing,Darth Vader
121,69,Who played the alien in Predator jumping and climbing scenes,Jean-Claude Van Damme
121,85,Name the first film to have its sequel released in the same year,King Kong - Son of Kong
121,92,Name the first cartoon character made into a parade balloon,Felix the Cat
121,96,T H White wrote the book for which Disney animated feature,Sword in the Stone
