Page #,Question #,Question Text,Answer
151,53,Which TV gangster owns the nightclub called The Ba Da Bing,Tony Soprano
151,56,Israel Baline became more more famous under what name,Irving Berlin
151,60,Who is the only director to win 3 Oscars within five years in 30s,Frank Capra 1934 1936 1938
151,80,Which 1977 film won seven Oscars but none for acting,Star Wars
151,84,Arthur Sarsfield Ward the creator of Fu Man Chu is which author,Sax Rohmer
151,90,Alfred Hitchcock's daughter appeared in Psycho - name her,Patricia Hitchcock
151,91,Who lived in Honalee,Puff the magic dragon
