Page #,Question #,Question Text,Answer
141,51,What was the name of the dog in Peter Pan,Nana
141,54,Who rode a horse called Lamri,King Arthur
141,68,In George Orwell's Animal Farm what type of animal was Muriel,The Goat
141,75,Shakespeare wrote Cruel only to be kind in what play,Hamlet
141,80,Which English King rode a horse called White Surrey,Richard III
141,82,Quilp (A Dwarf) is a character in which Dickens novel,The Old Curiosity Shop
141,88,Which countries leader was an extra in Hollywood,Fidel Castro
141,89,BOZ was the penname if which writer,Charles Dickens
141,94,Who wrote the play Androcles and the Lion,George Bernard Shaw
